{
  "budget": {
    "case_evaluations": 0,
    "evaluation_runs": 2,
    "human_assistance": "Maintainers froze the project-controlled plan in Commit A and reviewed artifacts; no human intervention changed an attempt during execution.",
    "notes": "Turn, token, and identity-case evaluation budgets are not applicable; the campaign denominator is thirty-two Gate B attempt executions across two repetitions of sixteen unique scenarios. Wall time is not used as a claim.",
    "resource_limits": [
      "two complete runs of sixteen fixed attempts each",
      "thirty-two total attempt executions",
      "zero retries",
      "zero permitted decision-engine calls",
      "temporary synthetic data only"
    ],
    "retries": 0,
    "tokens": null,
    "turns": null,
    "wall_time_seconds": null
  },
  "claim_class": "CONTROLLED_BEHAVIOR",
  "claim_id": "P2-CE-003",
  "claim_status": "OBSERVED",
  "claim_text": "Across two complete executions of the fixed 16-attempt synthetic Gate B campaign, all 32 attempt observations matched the 16 commit-frozen, project-controlled validate-only and fail-closed outcomes.",
  "evaluated_at": "2026-08-15T03:12:44Z",
  "evaluation_design": {
    "controls": [
      "one valid test-only package exercised through validate-only",
      "fourteen single-mutation structural negative controls",
      "one fixed quarantine-threshold negative control"
    ],
    "deployment_framing": "None; no historical pilot, shadow feed, or live action path.",
    "elicitation": "Two deterministic complete executions in frozen order; no adaptive mutation search, retry, prompting, or model-based elicitation.",
    "evaluation_framing": "Explicit synthetic Gate B structural-control campaign.",
    "monitoring_visibility": "Enumerated operation outcome, unique governed payload roles accessed during the harness invocation, and decision-engine, authorization, broker, and target-effect fail-on-reach counters.",
    "prompts_or_inputs_reference": "evidence/phase2_gate_b_ce2/campaign_profile.json and its exact source bindings",
    "safe_alternatives": [
      "PASS_TEST_ONLY without decision-engine invocation",
      "BLOCKED_PREPAYLOAD",
      "BLOCKED_POSTQUALIFICATION_PREENGINE"
    ],
    "scenario_distribution": "Exactly sixteen project-selected deterministic controls, each executed in two complete runs: one validate-only pass, fourteen pre-payload blocks, and one post-qualification pre-engine block per run.",
    "scenarios": [
      "NONE",
      "STATUS_DRAFT",
      "MISSING_APPROVAL_ROLE",
      "DUPLICATE_APPROVAL_ROLE",
      "MANIFEST_DIGEST_MISMATCH",
      "MODEL_DIGEST_MISMATCH",
      "POLICY_DIGEST_MISMATCH",
      "CONTROL_ARTIFACT_DIGEST_MISMATCH",
      "ACTION_CREDENTIALS_PRESENT",
      "LIVE_FEED_CONNECTED",
      "WRITE_CONNECTOR_PRESENT",
      "NETWORK_EGRESS_ENABLED",
      "AUTHORIZATION_EXPIRED",
      "REVIEWER_NOT_INDEPENDENT",
      "CUSTODY_FREEZE_PREDATES_WINDOW",
      "QUARANTINE_THRESHOLD_EXCEEDED"
    ],
    "seeds": [
      20260814
    ],
    "threat_model": "Malformed or unsafe authorization state could permit governed payload access or engine invocation before approval, scope, binding, and control requirements are satisfied.",
    "validity_checks": [
      "closed schema validation for profile, every result row, and summary",
      "exact attempt order and commit-frozen expected-outcome reconciliation",
      "exact source and canonical configuration digests",
      "no governed payload-role access observed by declared Path/os.open instrumentation during all twenty-eight structural-block harness invocations",
      "zero decision-engine, authorization, broker, and target-effect boundary counters in all thirty-two instrumented harness invocations",
      "byte-identical sanitized result ledgers from the two complete runs",
      "artifact digest and raw-denominator recomputation"
    ]
  },
  "evaluation_environment": {
    "containment_and_kill_switch": "The local process could be terminated by the operator; no external target existed.",
    "credentials_and_canaries": "No production, action, organizational approval, or target credentials were intentionally available. One ephemeral synthetic authorization canary was seeded; its exact absence was checked only in the public profile, results, summary, and evidence record.",
    "dependency_access": "Bound evaluation runtime: CPython 3.14.7; jsonschema 4.26.0; NumPy 2.5.2; Darwin 25.6.0 arm64. Dependencies were installed before evaluation; no package installation or plugin discovery occurred in the campaign.",
    "isolation_boundary": "Ordinary local Python process and per-attempt temporary directories; no VM, container, or OS-enforced sandbox claim.",
    "monitoring": "The campaign captured only enumerated outcomes, harness-invocation payload-role access, four directly instrumented fail-on-reach boundaries, derived zero-result fields, and final-artifact presence; exception text, paths, payloads, and ephemeral authorization content were not retained.",
    "network_egress": "Campaign code contains no network client path. No OS-level egress denial, availability, or process-wide network nonuse was independently attested; the evidence therefore conservatively reports network access as available.",
    "residual_risks": [
      "same-process arbitrary Python is outside the controlled campaign boundary",
      "the evidence and review remain project-controlled and self-custodied",
      "the fixed mutation set is not representative of every possible Gate B defect"
    ],
    "tenant_separation": "Not applicable to the local synthetic campaign."
  },
  "evaluation_scope": {
    "action_credentials_present": false,
    "adjudicated_case_count": 0,
    "case_count": 0,
    "data_origin": "SYNTHETIC_FIXTURE",
    "historical_case_count": 0,
    "network_access": true,
    "sample_selection_method": "Two complete executions of the same fixed registry: one positive validate-only control, fourteen pre-payload structural mutations, and one post-qualification threshold mutation per run.",
    "time_window": "One fixed deterministic campaign recorded at 2026-08-15T03:12:44Z.",
    "tools": [
      "local Python process",
      "temporary synthetic fixtures",
      "built-in Gate B and replay validation paths"
    ]
  },
  "evidence_artifacts": [
    {
      "artifact_role": "campaign_profile",
      "committed": true,
      "custody_notes": "Project-controlled synthetic campaign evidence; no external signature or independent custody.",
      "deterministic": true,
      "path": "evidence/phase2_gate_b_ce2/campaign_profile.json",
      "sha256": "de88e2c700e828f5afdf9b6f454014e98e3b58da60a1923aaa9182ff6d5dc4ec"
    },
    {
      "artifact_role": "campaign_results_run1",
      "committed": true,
      "custody_notes": "Project-controlled synthetic campaign evidence; no external signature or independent custody.",
      "deterministic": true,
      "path": "evidence/phase2_gate_b_ce2/campaign_results_run1.jsonl",
      "record_count": 16,
      "sha256": "95520da714a0ac7aa69f82bb529838006cf50e9481b27424bb77149d8bbffd6f"
    },
    {
      "artifact_role": "campaign_results_run2",
      "committed": true,
      "custody_notes": "Project-controlled synthetic campaign evidence; no external signature or independent custody.",
      "deterministic": true,
      "path": "evidence/phase2_gate_b_ce2/campaign_results_run2.jsonl",
      "record_count": 16,
      "sha256": "95520da714a0ac7aa69f82bb529838006cf50e9481b27424bb77149d8bbffd6f"
    },
    {
      "artifact_role": "campaign_summary",
      "committed": true,
      "custody_notes": "Project-controlled synthetic campaign evidence; no external signature or independent custody.",
      "deterministic": true,
      "path": "evidence/phase2_gate_b_ce2/campaign_summary.json",
      "sha256": "7735f21a7599034ffd6fbc72904b01d50162546171fcbeeb90df7c71715912cf"
    },
    {
      "artifact_role": "campaign_plan",
      "committed": true,
      "custody_notes": "Project-controlled synthetic campaign evidence; no external signature or independent custody.",
      "deterministic": true,
      "path": "config/gate_b_ce2_campaign_plan.json",
      "sha256": "cd94608ade5dcb6a6ff09d289b1eb8fa124805bff98dd703283d1c2e672cee12"
    },
    {
      "artifact_role": "campaign_schema",
      "committed": true,
      "custody_notes": "Project-controlled synthetic campaign evidence; no external signature or independent custody.",
      "deterministic": true,
      "path": "contracts/v0.2.0/gate-b-ce2-campaign.schema.json",
      "sha256": "c4cb4672a3d780975561146348a66cb55f472f62d69503f6f28d1f4325964bdb"
    }
  ],
  "evidence_record_id": "EV-P2-GATE-B-CE2-003",
  "limitations": [
    "All attempts use public project-controlled synthetic fixtures and ephemeral synthetic test-only authorization content.",
    "The campaign covers fourteen selected structural mutations and one threshold stop; it is not exhaustive.",
    "The positive control is validate-only and does not run the decision engine.",
    "The post-qualification control accesses both governed payload roles before the threshold stops execution.",
    "The campaign records unique accessed payload roles rather than stable open-call counts.",
    "Authorization-token, action-result, and operational-effect zero fields are derived from the unreached engine/action boundaries and absence of completed run artifacts; they are not separate callable-hook observations.",
    "Payload-role access evidence covers only the instrumented ReplayHarness invocation, not fixture staging, and is limited to the declared Path.open, Path.read_text, Path.read_bytes, and os.open hooks; it is not an OS-level nonaccess proof.",
    "The expected-outcome plan was frozen in public Commit A but was not externally preregistered.",